{
  "version": 1,
  "id": "2.matematicas.4.s37",
  "ciclo": 2,
  "area": "matematicas",
  "curso": 4,
  "semana": 37,
  "tipo": "tema",
  "titulo": {
    "es": "Por 10, 100 y 1000 con decimales",
    "va": "Per 10, 100 i 1000 amb decimals",
    "en": "Times 10, 100 and 1000 with decimals",
    "fr": "Fois 10, 100 et 1000 avec des décimaux",
    "ar": "الضرب في 10 و100 و1000 مع الأعداد العشرية"
  },
  "objetivo": {
    "es": "Esta semana conocen las milésimas y cambian de unidad multiplicando o dividiendo por 10, 100 y 1000: 0,250 kg son 250 g, porque {{0,250 × 1000 = 250}}. Las cifras se mueven de casilla y la coma se queda quieta.",
    "va": "Aquesta setmana coneixen les mil·lèsimes (milésimas) i canvien d'unitat multiplicant o dividint per 10, 100 i 1000: 0,250 kg són 250 g, perquè {{0,250 × 1000 = 250}}. Les xifres es mouen de casella i la coma es queda quieta.",
    "en": "This week they meet thousandths (milésimas) and change units by multiplying or dividing by 10, 100 and 1000: 0,250 kg is 250 g, because {{0,250 × 1000 = 250}}. The digits move to other boxes and the comma stays still.",
    "fr": "Cette semaine, on découvre les millièmes (milésimas) et on change d'unité en multipliant ou en divisant par 10, 100 et 1000 : 0,250 kg font 250 g, parce que {{0,250 × 1000 = 250}}. Les chiffres changent de case et la virgule reste en place.",
    "ar": "هذا الأسبوع يتعرّف الأطفال إلى الأجزاء من ألف (milésimas)، ويغيّرون الوحدات بالضرب أو القسمة على 10 و100 و1000: 0,250 كغ تساوي 250 غ، لأن {{0,250 × 1000 = 250}}. الأرقام تنتقل من خانة إلى أخرى والفاصلة تبقى مكانها."
  },
  "comoAyudar": {
    "es": "Usad la máquina de las cifras de la semana 30, ahora con una casilla para la coma. Si duda, preguntad: «¿La unidad nueva es más grande o más pequeña? Entonces, ¿saldrá un número mayor o menor?».",
    "va": "Feu servir la màquina de les xifres de la setmana 30, ara amb una casella per a la coma. Si dubta, pregunteu: «La unitat nova és més gran o més menuda? Aleshores, eixirà un nombre major o menor?».",
    "en": "Use the digit machine from week 30, now with a box for the comma. If they're unsure, ask: “Is the new unit bigger or smaller? So will the number be bigger or smaller?”",
    "fr": "Utilisez la machine à chiffres de la semaine 30, maintenant avec une case pour la virgule. En cas de doute, demandez : « La nouvelle unité est-elle plus grande ou plus petite ? Alors, le nombre sera-t-il plus grand ou plus petit ? ».",
    "ar": "استعملوا آلة الأرقام من الأسبوع 30، والآن مع خانة للفاصلة. وإذا تردّد الأطفال، اسألوا: «هل الوحدة الجديدة أكبر أم أصغر؟ إذن هل سيكون العدد أكبر أم أصغر؟»."
  },
  "saberes": [
    "matematicas.fracciones.por-10-100-1000",
    "matematicas.fracciones.decimales",
    "matematicas.medida.unidades"
  ],
  "criterios": [
    "matematicas.c2.2.3",
    "matematicas.c2.5.3"
  ],
  "reto": {
    "titulo": {
      "es": "Etiquetas de la compra",
      "va": "Etiquetes de la compra",
      "en": "Shopping labels",
      "fr": "Les étiquettes des courses",
      "ar": "ملصقات المشتريات"
    },
    "material": [
      {
        "es": "Etiquetas o envases de la compra (queso, embutido, fruta, botellas)",
        "va": "Etiquetes o envasos de la compra (formatge, embotit, fruita, botelles)",
        "en": "Shopping labels or packaging (cheese, cold meats, fruit, bottles)",
        "fr": "Des étiquettes ou des emballages des courses (fromage, charcuterie, fruits, bouteilles)",
        "ar": "ملصقات أو عبوات من المشتريات (جبن، لحوم باردة، فاكهة، زجاجات)"
      },
      {
        "es": "Papel y lápiz",
        "va": "Paper i llapis",
        "en": "Paper and a pencil",
        "fr": "Du papier et un crayon",
        "ar": "ورقة وقلم رصاص"
      }
    ],
    "minutos": 15,
    "pasos": [
      {
        "pictograma": "ticket",
        "texto": {
          "es": "Buscad etiquetas con pesos o capacidades escritos con coma, como 0,250 kg o 1,5 l. Apuntad tres o cuatro.",
          "va": "Busqueu etiquetes amb pesos o capacitats escrits amb coma, com ara 0,250 kg o 1,5 l. Apunteu-ne tres o quatre.",
          "en": "Find labels with weights or capacities written with a comma, like 0,250 kg or 1,5 l. Write down three or four.",
          "fr": "Cherchez des étiquettes avec des poids ou des contenances écrits avec une virgule, comme 0,250 kg ou 1,5 l. Notez-en trois ou quatre.",
          "ar": "ابحثوا عن ملصقات عليها أوزان أو سعات مكتوبة بفاصلة، مثل 0,250 كغ أو 1,5 لتر. دوّنوا ثلاثة أو أربعة منها."
        }
      },
      {
        "pictograma": "papel",
        "texto": {
          "es": "Dibujad una tabla con casillas: millares, centenas, decenas, unidades, coma, décimas, centésimas y milésimas. Colocad 0,250 kg: el 0 en las unidades, el 2 en las décimas, el 5 en las centésimas y el 0 en las milésimas.",
          "va": "Dibuixeu una taula amb caselles: milers, centenes, desenes, unitats, coma, dècimes, centèsimes i mil·lèsimes. Col·loqueu 0,250 kg: el 0 en les unitats, el 2 en les dècimes, el 5 en les centèsimes i el 0 en les mil·lèsimes.",
          "en": "Draw a table with boxes: thousands, hundreds, tens, ones, comma, tenths, hundredths and thousandths. Place 0,250 kg: the 0 in the ones, the 2 in the tenths, the 5 in the hundredths and the 0 in the thousandths.",
          "fr": "Dessinez un tableau avec des cases : milliers, centaines, dizaines, unités, virgule, dixièmes, centièmes et millièmes. Placez 0,250 kg : le 0 dans les unités, le 2 dans les dixièmes, le 5 dans les centièmes et le 0 dans les millièmes.",
          "ar": "ارسموا جدولًا بخانات: الآلاف، والمئات، والعشرات، والآحاد، والفاصلة، والأعشار، والأجزاء من مئة، والأجزاء من ألف. ضعوا 0,250 كغ: 0 في الآحاد، و2 في الأعشار، و5 في الأجزاء من مئة، و0 في الأجزاء من ألف."
        }
      },
      {
        "pictograma": "manos",
        "texto": {
          "es": "Para pasar a gramos, multiplicad por 1000: cada cifra se mueve tres casillas hacia la izquierda y la coma se queda quieta. Sale 250 g.",
          "va": "Per a passar a grams, multipliqueu per 1000: cada xifra es mou tres caselles cap a l'esquerra i la coma es queda quieta. Ix 250 g.",
          "en": "To change to grams, multiply by 1000: each digit moves three boxes to the left and the comma stays still. You get 250 g.",
          "fr": "Pour passer en grammes, multipliez par 1000 : chaque chiffre se déplace de trois cases vers la gauche et la virgule reste en place. On obtient 250 g.",
          "ar": "للتحويل إلى غرامات، اضربوا في 1000: ينتقل كل رقم ثلاث خانات إلى اليسار والفاصلة تبقى مكانها. فنحصل على 250 غ."
        }
      },
      {
        "pictograma": "balanza",
        "texto": {
          "es": "Haced lo mismo con las otras etiquetas. Y al revés: 1500 ml, ¿cuántos litros son? Dividid entre 1000: 1,5 l.",
          "va": "Feu el mateix amb les altres etiquetes. I al revés: 1500 ml, quants litres són? Dividiu entre 1000: 1,5 l.",
          "en": "Do the same with the other labels. And the other way round: 1500 ml, how many litres is that? Divide by 1000: 1,5 l.",
          "fr": "Faites pareil avec les autres étiquettes. Et à l'envers : 1500 ml, combien de litres ça fait ? Divisez par 1000 : 1,5 l.",
          "ar": "افعلوا الشيء نفسه مع الملصقات الأخرى. وبالعكس: 1500 مل، كم لترًا هذا؟ اقسموا على 1000: 1,5 لتر."
        }
      }
    ],
    "masFacil": {
      "es": "Usad solo metros y centímetros, que se cambian por 100, y la cinta métrica delante.",
      "va": "Feu servir només metres i centímetres, que es canvien per 100, i la cinta mètrica davant.",
      "en": "Use only metres and centimetres, which change by 100, with the tape measure in front of you.",
      "fr": "Utilisez seulement des mètres et des centimètres, qui se changent par 100, avec le mètre ruban devant vous.",
      "ar": "استعملوا الأمتار والسنتيمترات فقط، فهي تتحوّل بالضرب في 100، والشريط أمامكم."
    },
    "masDificil": {
      "es": "Comparad dos etiquetas en unidades distintas, como 0,75 kg y 700 g. ¿Cuál pesa más? Pasadlas antes a la misma unidad.",
      "va": "Compareu dues etiquetes en unitats diferents, com ara 0,75 kg i 700 g. Quina pesa més? Passeu-les abans a la mateixa unitat.",
      "en": "Compare two labels in different units, like 0,75 kg and 700 g. Which is heavier? Change them to the same unit first.",
      "fr": "Comparez deux étiquettes dans des unités différentes, comme 0,75 kg et 700 g. Laquelle pèse le plus ? Passez-les d'abord dans la même unité.",
      "ar": "قارنوا ملصقين بوحدتين مختلفتين، مثل 0,75 كغ و700 غ. أيّهما أثقل؟ حوّلوهما أولًا إلى الوحدة نفسها."
    },
    "paraQueSirve": {
      "es": "Las etiquetas de la compra cambian de unidad todo el tiempo: kilos y gramos, litros y mililitros. Saber pasar de una a otra sirve para comparar precios y para cocinar.",
      "va": "Les etiquetes de la compra canvien d'unitat tot el temps: quilos i grams, litres i mil·lilitres. Saber passar d'una a l'altra servix per a comparar preus i per a cuinar.",
      "en": "Shopping labels change units all the time: kilos and grams, litres and millilitres. Knowing how to go from one to the other helps with comparing prices and cooking.",
      "fr": "Les étiquettes des courses changent d'unité tout le temps : kilos et grammes, litres et millilitres. Savoir passer de l'une à l'autre sert à comparer les prix et à cuisiner.",
      "ar": "ملصقات المشتريات تغيّر الوحدات طوال الوقت: كيلوغرامات وغرامات، لترات ومليلترات. ومعرفة التحويل بينها تفيد في مقارنة الأسعار وفي الطبخ."
    }
  },
  "preguntas": [
    {
      "id": "p1",
      "rol": "tema",
      "tipoProblema": "medida",
      "texto": {
        "es": "Un paquete de queso pesa 0,250 kg. ¿Cuántos gramos son?",
        "va": "Un paquet de formatge pesa 0,250 kg. Quants grams són?",
        "en": "A packet of cheese weighs 0,250 kg. How many grams is that?",
        "fr": "Un paquet de fromage pèse 0,250 kg. Combien de grammes cela fait-il ?",
        "ar": "وزن علبة جبن 0,250 كغ. كم غرامًا هذا؟"
      },
      "pista": {